{
  "schema_version": 2,
  "name": "pylon-catalog",
  "display_name": "Pylon 카탈로그",
  "description": "Pylon Grid 에 설치할 수 있는 MCP 서버와 플러그인 목록",
  "servers": [
    {
      "name": "google-calendar",
      "display_name": "Google 캘린더",
      "description": "일정 조회·생성·응답·삭제, 바쁜 시간 조회",
      "version": "0.1.0",
      "repository": "https://github.com/nexusai-kr/pylon-mcp-google-calendar",
      "license": "Apache-2.0",
      "download": "https://github.com/nexusai-kr/pylon-mcp-google-calendar/releases/download/v0.1.0/google-calendar-0.1.0.mcpb",
      "sha256": "4349fbab6e153f79e7221b43f8e193a3c95a27a2360472882e5b8c3b1e0d75c7",
      "size_bytes": 18078055,
      "platforms": [
        "linux-x86_64"
      ],
      "tools": [
        "list_calendars",
        "list_events",
        "get_event",
        "find_free_busy",
        "create_event",
        "respond_to_event",
        "delete_event"
      ],
      "requires": {
        "connection": "google",
        "scopes": [
          "https://www.googleapis.com/auth/calendar.calendarlist.readonly",
          "https://www.googleapis.com/auth/calendar.events.freebusy",
          "https://www.googleapis.com/auth/calendar.events.readonly",
          "https://www.googleapis.com/auth/calendar.events"
        ]
      }
    },
    {
      "name": "google-docs",
      "display_name": "Google 문서",
      "description": "문서 읽기·만들기·덧붙이기·텍스트 바꾸기",
      "version": "0.1.0",
      "repository": "https://github.com/nexusai-kr/pylon-mcp-google-docs",
      "license": "Apache-2.0",
      "download": "https://github.com/nexusai-kr/pylon-mcp-google-docs/releases/download/v0.1.0/google-docs-0.1.0.mcpb",
      "sha256": "4fcec17c1791c204349056133bfa14c06d7619d279242e1f2692e87900781ee6",
      "size_bytes": 18076423,
      "platforms": [
        "linux-x86_64"
      ],
      "tools": [
        "read_doc",
        "create_doc",
        "append_text",
        "replace_text"
      ],
      "requires": {
        "connection": "google",
        "scopes": [
          "https://www.googleapis.com/auth/drive.readonly",
          "https://www.googleapis.com/auth/drive.file",
          "https://www.googleapis.com/auth/documents.readonly",
          "https://www.googleapis.com/auth/documents"
        ]
      }
    },
    {
      "name": "google-drive",
      "display_name": "Google 드라이브",
      "description": "파일 검색·내용 읽기·텍스트 파일 만들기",
      "version": "0.1.0",
      "repository": "https://github.com/nexusai-kr/pylon-mcp-google-drive",
      "license": "Apache-2.0",
      "download": "https://github.com/nexusai-kr/pylon-mcp-google-drive/releases/download/v0.1.0/google-drive-0.1.0.mcpb",
      "sha256": "65f0f889606c499c1bcbd9bba50eb0259073353a35d50886e3f152bb604af0fc",
      "size_bytes": 18077669,
      "platforms": [
        "linux-x86_64"
      ],
      "tools": [
        "search_files",
        "list_recent_files",
        "get_file_metadata",
        "get_file_permissions",
        "read_file_content",
        "create_text_file"
      ],
      "requires": {
        "connection": "google",
        "scopes": [
          "https://www.googleapis.com/auth/drive.readonly",
          "https://www.googleapis.com/auth/drive.file"
        ]
      }
    },
    {
      "name": "google-gmail",
      "display_name": "Gmail",
      "description": "메일 검색·읽기·초안 작성",
      "version": "0.1.0",
      "repository": "https://github.com/nexusai-kr/pylon-mcp-google-gmail",
      "license": "Apache-2.0",
      "download": "https://github.com/nexusai-kr/pylon-mcp-google-gmail/releases/download/v0.1.0/google-gmail-0.1.0.mcpb",
      "sha256": "d46b6cde8d09cfeb987bf1daad41e91d2750aea908991d4588d57f55ffdf1846",
      "size_bytes": 18077516,
      "platforms": [
        "linux-x86_64"
      ],
      "tools": [
        "search_messages",
        "get_message",
        "get_thread",
        "list_labels",
        "create_draft"
      ],
      "requires": {
        "connection": "google",
        "scopes": [
          "https://www.googleapis.com/auth/gmail.readonly",
          "https://www.googleapis.com/auth/gmail.compose"
        ]
      }
    },
    {
      "name": "google-sheets",
      "display_name": "Google 스프레드시트",
      "description": "시트 값 읽기·쓰기·행 추가·새 시트",
      "version": "0.1.0",
      "repository": "https://github.com/nexusai-kr/pylon-mcp-google-sheets",
      "license": "Apache-2.0",
      "download": "https://github.com/nexusai-kr/pylon-mcp-google-sheets/releases/download/v0.1.0/google-sheets-0.1.0.mcpb",
      "sha256": "d5bca6337038f9ed81e5e2d94c4c8181b0f442e2d49d718bc80936c9c5b24c47",
      "size_bytes": 18076915,
      "platforms": [
        "linux-x86_64"
      ],
      "tools": [
        "get_spreadsheet",
        "get_values",
        "update_values",
        "append_values",
        "create_spreadsheet"
      ],
      "requires": {
        "connection": "google",
        "scopes": [
          "https://www.googleapis.com/auth/drive.readonly",
          "https://www.googleapis.com/auth/drive.file",
          "https://www.googleapis.com/auth/spreadsheets.readonly",
          "https://www.googleapis.com/auth/spreadsheets"
        ]
      }
    },
    {
      "name": "google-slides",
      "display_name": "Google 프레젠테이션",
      "description": "슬라이드 읽기·만들기·추가·텍스트 바꾸기",
      "version": "0.1.1",
      "repository": "https://github.com/nexusai-kr/pylon-mcp-google-slides",
      "license": "Apache-2.0",
      "download": "https://github.com/nexusai-kr/pylon-mcp-google-slides/releases/download/v0.1.1/google-slides-0.1.1.mcpb",
      "sha256": "2d0b597a67de4689764aa7cfe688dfc3259acd36c629380dcef99043f64b03ab",
      "size_bytes": 18077360,
      "platforms": [
        "linux-x86_64"
      ],
      "tools": [
        "read_presentation",
        "get_slide_thumbnail",
        "create_presentation",
        "add_slide",
        "replace_text"
      ],
      "requires": {
        "connection": "google",
        "scopes": [
          "https://www.googleapis.com/auth/drive.readonly",
          "https://www.googleapis.com/auth/drive.file",
          "https://www.googleapis.com/auth/presentations.readonly",
          "https://www.googleapis.com/auth/presentations"
        ]
      }
    }
  ],
  "plugins": []
}
